{
  "format": "dc-roster-v1",
  "approval": "Roster IDs, names and Class/Race/Origin assignments: approved by the owner on 2026-10-11 (DECISIONS.md D-017 to D-021). Everything under `proposed` (cost, rarity, Role, ability and Feat text, design status, notes) is PROPOSED content: preserved from the workbook, not confirmed, and not executed by the engine.",
  "source": {
    "file": "content/roster/source/Dungeons_and_Champions_Roster_135_Option_A_Unique_Combinations.xlsx",
    "sheet": "Champion Roster",
    "sha256": "a3b302cdac63d45235309530c8b76b4748ea640a52c42b61db612ed99ef49bfe"
  },
  "champions": [
    {
      "id": "DC-001",
      "name": "Aerin Ashford 001",
      "class": "Artificer",
      "race": "Aasimar",
      "origin": "Acolyte",
      "proposed": {
        "cost_rank": 4,
        "rarity": "Epic",
        "role": "Bruiser",
        "basic_attack": "Rending Strike — Physical damage; scales with Attack.",
        "passive": "When below 50% Health, gain a small Attack bonus. (PROPOSED)",
        "ultimate": "Ragequake: deals heavy physical damage to the frontmost enemies. (PROPOSED)",
        "feat_milestone_1": "Relentless: gain durability after defeating an enemy. (PROPOSED)",
        "feat_milestone_2": "Unbreakable: improves class identity. (PROPOSED)",
        "design_status": "DRAFT — needs design review",
        "notes": "Names, kit effects, costs and Trait identities are proposals; validate against authoritative game rules."
      }
    },
    {
      "id": "DC-002",
      "name": "Bram Ironwood 002",
      "class": "Barbarian",
      "race": "Dragonborn",
      "origin": "Arcane",
      "proposed": {
        "cost_rank": 2,
        "rarity": "Uncommon",
        "role": "Controller",
        "basic_attack": "Arcane Dart — Magical damage; scales with Spell Power.",
        "passive": "After casting an Ultimate, gains a brief Spell Power bonus. (PROPOSED)",
        "ultimate": "Meteor Script: delayed area magical damage. (PROPOSED)",
        "feat_milestone_1": "Arcane Preparation: improves post-Ultimate bonus. (PROPOSED)",
        "feat_milestone_2": "Runic Barrier: improves class identity. (PROPOSED)",
        "design_status": "DRAFT — needs design review",
        "notes": "Names, kit effects, costs and Trait identities are proposals; validate against authoritative game rules."
      }
    },
    {
      "id": "DC-003",
      "name": "Celia Proudmoore 003",
      "class": "Bard",
      "race": "Dwarf",
      "origin": "Cultist",
      "proposed": {
        "cost_rank": 2,
        "rarity": "Uncommon",
        "role": "Assassin",
        "basic_attack": "Quick Stab — Physical damage; scales with Attack.",
        "passive": "First attack against a new target has bonus critical chance. (PROPOSED)",
        "ultimate": "Death from Shadow: heavy damage to the lowest-Health enemy. (PROPOSED)",
        "feat_milestone_1": "Calculated Opening: improves first-strike benefit. (PROPOSED)",
        "feat_milestone_2": "Smoke and Mirrors: improves class identity. (PROPOSED)",
        "design_status": "DRAFT — needs design review",
        "notes": "Names, kit effects, costs and Trait identities are proposals; validate against authoritative game rules."
      }
    },
    {
      "id": "DC-004",
      "name": "Dain Windrider 004",
      "class": "Cleric",
      "race": "Elf",
      "origin": "Fey-Touched",
      "proposed": {
        "cost_rank": 3,
        "rarity": "Rare",
        "role": "Bruiser",
        "basic_attack": "Rending Strike — Physical damage; scales with Attack.",
        "passive": "When below 50% Health, gain a small Attack bonus. (PROPOSED)",
        "ultimate": "Ragequake: deals heavy physical damage to the frontmost enemies. (PROPOSED)",
        "feat_milestone_1": "Relentless: gain durability after defeating an enemy. (PROPOSED)",
        "feat_milestone_2": "Unbreakable: improves class identity. (PROPOSED)",
        "design_status": "DRAFT — needs design review",
        "notes": "Names, kit effects, costs and Trait identities are proposals; validate against authoritative game rules."
      }
    },
    {
      "id": "DC-005",
      "name": "Elara Northwind 005",
      "class": "Druid",
      "race": "Genasi",
      "origin": "Gladiator",
      "proposed": {
        "cost_rank": 4,
        "rarity": "Epic",
        "role": "Fighter",
        "basic_attack": "Measured Cut — Physical damage; scales with Attack.",
        "passive": "Every third Basic Attack gains a small damage bonus. (PROPOSED)",
        "ultimate": "Battlefield Sweep: strikes several enemies in the front rows. (PROPOSED)",
        "feat_milestone_1": "Adaptive Stance: choose a small Attack or Armor bonus. (PROPOSED)",
        "design_status": "DRAFT — needs design review",
        "notes": "Names, kit effects, costs and Trait identities are proposals; validate against authoritative game rules."
      },
      "excluded": {
        "feat_milestone_2": "Multi-Class Feat text excluded (D-020)"
      }
    },
    {
      "id": "DC-006",
      "name": "Fen Goldleaf 006",
      "class": "Fighter",
      "race": "Githyanki",
      "origin": "Knight",
      "proposed": {
        "cost_rank": 4,
        "rarity": "Epic",
        "role": "Mage",
        "basic_attack": "Arc Spark — Magical damage; scales with Spell Power.",
        "passive": "Ultimate resource gain is slightly increased. (PROPOSED)",
        "ultimate": "Prismatic Cataclysm: area magical damage. (PROPOSED)",
        "feat_milestone_1": "Resonant Casting: improves resource generation. (PROPOSED)",
        "feat_milestone_2": "Spell Echo: improves class identity. (PROPOSED)",
        "design_status": "DRAFT — needs design review",
        "notes": "Names, kit effects, costs and Trait identities are proposals; validate against authoritative game rules."
      }
    },
    {
      "id": "DC-007",
      "name": "Galen Nightwell 007",
      "class": "Gunslinger",
      "race": "Gnome",
      "origin": "Mercenary",
      "proposed": {
        "cost_rank": 4,
        "rarity": "Epic",
        "role": "Fighter",
        "basic_attack": "Measured Cut — Physical damage; scales with Attack.",
        "passive": "Every third Basic Attack gains a small damage bonus. (PROPOSED)",
        "ultimate": "Battlefield Sweep: strikes several enemies in the front rows. (PROPOSED)",
        "feat_milestone_1": "Adaptive Stance: choose a small Attack or Armor bonus. (PROPOSED)",
        "feat_milestone_2": "Tactical Guard: improves class identity. (PROPOSED)",
        "design_status": "DRAFT — needs design review",
        "notes": "Names, kit effects, costs and Trait identities are proposals; validate against authoritative game rules."
      }
    },
    {
      "id": "DC-008",
      "name": "Hesta Umber 008",
      "class": "Monk",
      "race": "Goblin",
      "origin": "Noble",
      "proposed": {
        "cost_rank": 3,
        "rarity": "Rare",
        "role": "Mage",
        "basic_attack": "Arc Spark — Magical damage; scales with Spell Power.",
        "passive": "Ultimate resource gain is slightly increased. (PROPOSED)",
        "ultimate": "Prismatic Cataclysm: area magical damage. (PROPOSED)",
        "feat_milestone_1": "Resonant Casting: improves resource generation. (PROPOSED)",
        "feat_milestone_2": "Spell Echo: improves class identity. (PROPOSED)",
        "design_status": "DRAFT — needs design review",
        "notes": "Names, kit effects, costs and Trait identities are proposals; validate against authoritative game rules."
      }
    },
    {
      "id": "DC-009",
      "name": "Ilyan Highwater 009",
      "class": "Monster Hunter",
      "race": "Half-Elf",
      "origin": "Outlaw",
      "proposed": {
        "cost_rank": 3,
        "rarity": "Rare",
        "role": "Tank",
        "basic_attack": "Oathstrike — Physical damage; scales with Attack; radiant rider is a proposal.",
        "passive": "Begins combat with a protective shield. (PROPOSED)",
        "ultimate": "Dawn's Verdict: damages an enemy and shields the weakest ally. (PROPOSED)",
        "feat_milestone_1": "Unyielding Oath: improves shield duration. (PROPOSED)",
        "design_status": "DRAFT — needs design review",
        "notes": "Names, kit effects, costs and Trait identities are proposals; validate against authoritative game rules."
      },
      "excluded": {
        "feat_milestone_2": "Multi-Class Feat text excluded (D-020)"
      }
    },
    {
      "id": "DC-010",
      "name": "Jora Emberfall 010",
      "class": "Paladin",
      "race": "Halfling",
      "origin": "Pirate",
      "proposed": {
        "cost_rank": 1,
        "rarity": "Common",
        "role": "Support",
        "basic_attack": "Dissonant Note — Magical damage; scales with Attack or Spell Power (balance pending).",
        "passive": "Periodically grants a nearby ally a small resource bonus. (PROPOSED)",
        "ultimate": "Grand Finale: damages enemies and grants allies a brief offensive buff. (PROPOSED)",
        "feat_milestone_1": "Inspiring Cadence: allies gain a small defensive bonus. (PROPOSED)",
        "feat_milestone_2": "Battle Hymn: improves class identity. (PROPOSED)",
        "design_status": "DRAFT — needs design review",
        "notes": "Names, kit effects, costs and Trait identities are proposals; validate against authoritative game rules."
      }
    },
    {
      "id": "DC-011",
      "name": "Kael Larkspur 011",
      "class": "Ranger",
      "race": "Human",
      "origin": "Scholar",
      "proposed": {
        "cost_rank": 3,
        "rarity": "Rare",
        "role": "Assassin",
        "basic_attack": "Quick Stab — Physical damage; scales with Attack.",
        "passive": "First attack against a new target has bonus critical chance. (PROPOSED)",
        "ultimate": "Death from Shadow: heavy damage to the lowest-Health enemy. (PROPOSED)",
        "feat_milestone_1": "Calculated Opening: improves first-strike benefit. (PROPOSED)",